{
  "$schema": "http://json-schema.org/draft-07/schema#",
  "$id": "https://photographercamera.local/schemas/photographer_profile.schema.json",
  "title": "PhotographerProfile",
  "description": "Phase 0 初始 Schema 草案。每个参数含类型/范围/默认/单位语义，以 profile_spec.md 第 3 节为权威说明。随 Phase 17 完善。",
  "type": "object",
  "required": ["version", "schema_version", "name", "exposure", "white_balance", "color_matrix", "hsl", "tone_curve", "highlight_rolloff", "shadow", "lens", "grain", "noise", "halation", "bloom", "vignette", "sharpen"],
  "properties": {
    "version": { "type": "integer", "minimum": 1, "description": "摄影师 Profile 迭代版本" },
    "schema_version": { "type": "integer", "minimum": 1, "default": 1, "description": "Profile 结构版本" },
    "name": { "type": "string" },
    "author": { "type": "string" },
    "description": { "type": "string" },
    "display": {
      "type": "object",
      "description": "可选：App 预设列表展示元数据，不参与 GPU 渲染。name=展示名（可含任意字符，优先于文件名，由 Studio「风格名称」原样写入）；intro=一句话简介（对应「滤镜简介」）；icon=同目录图标文件的扩展名，图标须与 profile JSON 同名成对存放（<profile文件名>.<icon>）",
      "properties": {
        "name": { "type": "string" },
        "intro": { "type": "string" },
        "icon": { "type": "string" }
      }
    },
    "created_at": { "type": "string" },
    "validation_status": { "type": "string", "enum": ["pending", "validated", "failed"] },
    "conditions": {
      "type": "object",
      "description": "可选：条件化 Profile（Phase 31）子参数集，键为 Daylight/Cloudy/Tungsten/Low Light/Flash/Backlight；每个值为一个（部分）Profile，可覆盖对应层参数",
      "additionalProperties": { "$ref": "#" }
    },
    "exposure": {
      "type": "object",
      "properties": {
        "bias": { "type": "number", "minimum": -2, "maximum": 2, "default": 0.0, "description": "整体曝光偏置，单位 EV" }
      }
    },
    "white_balance": {
      "type": "object",
      "properties": {
        "temperature_bias": { "type": "number", "minimum": -1, "maximum": 1, "default": 0.0, "description": "色温偏置，正=暖" },
        "tint_bias": { "type": "number", "minimum": -1, "maximum": 1, "default": 0.0, "description": "色调偏置，正=品红" }
      }
    },
    "color_matrix": {
      "type": "object",
      "properties": {
        "matrix_3x3": {
          "type": "array", "minItems": 3, "maxItems": 3,
          "items": { "type": "array", "minItems": 3, "maxItems": 3, "items": { "type": "number", "minimum": -2, "maximum": 2 } },
          "default": [[1,0,0],[0,1,0],[0,0,1]]
        },
        "input_gamut": { "type": "string", "default": "sRGB", "description": "预留/元数据：当前双端（Android 与 Studio CPU 参考）均无消费端（PA-07）。不改变渲染。" },
        "output_gamut": { "type": "string", "default": "sRGB", "description": "预留/元数据：当前双端均无消费端（PA-07）。不改变渲染。" }
      }
    },
    "hsl": {
      "type": "object",
      "properties": {
        "red":    { "$ref": "#/definitions/hsl_color" },
        "orange": { "$ref": "#/definitions/hsl_color" },
        "yellow": { "$ref": "#/definitions/hsl_color" },
        "green":  { "$ref": "#/definitions/hsl_color" },
        "cyan":   { "$ref": "#/definitions/hsl_color" },
        "blue":   { "$ref": "#/definitions/hsl_color" },
        "purple": { "$ref": "#/definitions/hsl_color" }
      }
    },
    "tone_curve": {
      "type": "object",
      "properties": {
        "points": {
          "type": "array", "minItems": 2,
          "items": { "type": "array", "minItems": 2, "maxItems": 2, "items": { "type": "number", "minimum": 0, "maximum": 1 } },
          "default": [[0,0],[1,1]]
        }
      }
    },
    "film_curve": {
      "type": "object",
      "description": "输出一致性胶片曲线（成像链最后一道 pass，位于 grain/vignette 之后）。shadow_floor / highlight_ceiling 单位为 0-255 显示级；膝点由上下限推导（C1 连续 soft-knee），共享同一 lo/hi 的所有 Profile 具有相同曲线特征。",
      "properties": {
        "shadow_floor": { "type": "number", "minimum": 0, "maximum": 64, "default": 8, "description": "暗部下限（显示级 0-255），低于暗部膝点的值平滑抬升至此下限，不压穿纯黑" },
        "highlight_ceiling": { "type": "number", "minimum": 191, "maximum": 255, "default": 248, "description": "高光上限（显示级 0-255），高于高光膝点的值平滑回卷至此上限，不生硬削顶" }
      }
    },
    "highlight_rolloff": {
      "type": "object",
      "properties": {
        "threshold": { "type": "number", "minimum": 0, "maximum": 1, "default": 0.8 },
        "strength":  { "type": "number", "minimum": 0, "maximum": 1, "default": 0.0 },
        "saturation": { "type": "number", "minimum": 0, "maximum": 2, "default": 1.0, "description": "预留/死参数（PA-07）：Android 实时通道无对应 uniform 消费端；仅桌面 apply_shadow 路径消费。双端不等价，标记为 inert，不在 Android 接线。" }
      }
    },
    "shadow": {
      "type": "object",
      "properties": {
        "black_point": { "type": "number", "minimum": 0, "maximum": 0.2, "default": 0.0 },
        "compression": { "type": "number", "minimum": 0, "maximum": 1, "default": 0.0 },
        "tint": { "type": "array", "minItems": 3, "maxItems": 3, "items": { "type": "number", "minimum": -1, "maximum": 1 }, "default": [0,0,0] },
        "saturation": { "type": "number", "minimum": 0, "maximum": 2, "default": 1.0 },
        "contrast":   { "type": "number", "minimum": 0, "maximum": 2, "default": 1.0 }
      }
    },
    "lens": {
      "type": "object",
      "properties": {
        "vignette": { "type": "number", "minimum": 0, "maximum": 1, "default": 0.0 },
        "chromatic_aberration": { "type": "number", "minimum": 0, "maximum": 1, "default": 0.0 },
        "sharpness_falloff": { "type": "number", "minimum": 0, "maximum": 1, "default": 0.0 },
        "distortion": { "type": "number", "minimum": -1, "maximum": 1, "default": 0.0 },
        "bloom": { "type": "number", "minimum": 0, "maximum": 1, "default": 0.0 },
        "flare": { "type": "number", "minimum": 0, "maximum": 1, "default": 0.0 }
      }
    },
    "grain": {
      "type": "object",
      "properties": {
        "amount":  { "type": "number", "minimum": 0, "maximum": 1, "default": 0.0 },
        "size":    { "type": "number", "minimum": 0.5, "maximum": 3, "default": 1.0 },
        "density": { "type": "number", "minimum": 0.5, "maximum": 3, "default": 1.0 },
        "luma_contrast": { "type": "number", "minimum": 0, "maximum": 1, "default": 1.0, "description": "胶片颗粒亮度分布对比：1=高光颗粒显著弱于暗部（胶片感），0=全画面均匀（假噪点）" }
      }
    },
    "noise": {
      "type": "object",
      "properties": {
        "luma":  { "type": "number", "minimum": 0, "maximum": 1, "default": 0.0 },
        "chroma": { "type": "number", "minimum": 0, "maximum": 1, "default": 0.0 }
      }
    },
    "halation": {
      "type": "object",
      "properties": {
        "amount":    { "type": "number", "minimum": 0, "maximum": 1, "default": 0.0 },
        "radius":    { "type": "number", "minimum": 0.5, "maximum": 6, "default": 1.0, "description": "羽化尺度：光晕/柔光溢出扩散范围基数，越大越宽越柔" },
        "threshold": { "type": "number", "minimum": 0, "maximum": 1, "default": 0.9 },
        "warmth":    { "type": "number", "minimum": 0, "maximum": 2, "default": 1.0 }
      }
    },
    "bloom": {
      "type": "object",
      "properties": {
        "amount":    { "type": "number", "minimum": 0, "maximum": 1, "default": 0.0 },
        "radius":    { "type": "number", "minimum": 0.5, "maximum": 6, "default": 1.0, "description": "羽化尺度：光晕/柔光溢出扩散范围基数，越大越宽越柔" },
        "threshold": { "type": "number", "minimum": 0, "maximum": 1, "default": 0.9 }
      }
    },
    "vignette": {
      "type": "object",
      "properties": {
        "amount":  { "type": "number", "minimum": 0, "maximum": 1, "default": 0.0 },
        "radius":  { "type": "number", "minimum": 0, "maximum": 1, "default": 1.0 },
        "feather": { "type": "number", "minimum": 0, "maximum": 1, "default": 0.5 },
        "center":  { "type": "array", "minItems": 2, "maxItems": 2, "items": { "type": "number", "minimum": 0, "maximum": 1 }, "default": [0.5,0.5] }
      }
    },
    "sharpen": {
      "type": "object",
      "properties": {
        "amount": { "type": "number", "minimum": 0, "maximum": 1, "default": 0.0 },
        "radius": { "type": "number", "minimum": 0.5, "maximum": 3, "default": 1.0 }
      }
    }
  },
  "definitions": {
    "hsl_color": {
      "type": "object",
      "properties": {
        "hue_shift":  { "type": "number", "minimum": -30, "maximum": 30, "default": 0, "description": "色相偏移，单位：度（degrees）。归一化旋转 = hue_shift / 360.0，与 Android HSL-LUT 阶段（assets/shaders/hsl.glsl / effect.frag，pl.b/360.0）逐字节一致（见 tests/test_shader_equivalence.py）。注意：Android 另有独立的 OKLCH 调色阶段（uLchHueAdjustments * radians(20.0)）使用不同缩放，它不在此字段的 HSL-LUT 路径内，不改变本字段语义。" },
        "saturation": { "type": "number", "minimum": 0, "maximum": 2, "default": 1.0 },
        "lightness":  { "type": "number", "minimum": 0, "maximum": 2, "default": 1.0 }
      }
    }
  }
}
